id,name,price,category,description,burn_time,wax_type,size,in_stock
1,Lavender Dream,399,Aromatherapy,Soothing lavender fragrance perfect for relaxation and stress relief.,30-40 hours,Soy Wax,200g,True
2,Vanilla Bliss,349,Traditional,Classic vanilla scent that creates a warm and inviting atmosphere.,30-40 hours,Soy Wax,200g,True
3,Rose Garden,449,Floral,Elegant rose fragrance blended with subtle notes of jasmine.,35-45 hours,Soy Wax,250g,True
4,Ocean Breeze,379,Fresh,Refreshing coastal scent with citrus and sea salt notes.,30-40 hours,Soy Wax,200g,True
5,Cinnamon Spice,389,Warm,"Warm and comforting blend of cinnamon, clove, and vanilla.",30-40 hours,Soy Wax,200g,True
6,Eucalyptus Fresh,369,Aromatherapy,Energizing eucalyptus oil for mental clarity and focus.,30-35 hours,Soy Wax,180g,True
7,Honey Amber,419,Sweet,Luxurious blend of honey and warm amber for lasting fragrance.,35-45 hours,Soy Wax,250g,True
8,Coffee & Cream,399,Gourmand,Rich coffee aroma with creamy vanilla undertones.,30-40 hours,Soy Wax,200g,True
